﻿investor,investee,mount,sentence
1,0,0,腾讯科技讯据外媒报道，小米印度公司负责人贾马库ManuKumarJain称，小米将会从其IPO融资资金中抽出一大块资金用于发展印度业务，尤其是打造其互联网服务生态系统、投资更多初创公司以及打造针对印度市场的物联网服务
1,0,0,小米还准备进军它迄今为止一直避开的印度高端智能手机市场
1,1,1,贾马库称，小米在上个月的IPO活动中总计融资45亿美元
0,0,0,该公司将会用其中30%的资金来做研发，用30%的资金建造物联网平台，用30%的资金进行全球扩张，剩下10%的资金则用于其他各种各样的开支
0,0,0,一部分全球扩张资金将会投入到印度市场
1,0,0,他说，我们的智能手机、充电宝和小米官网Mi.com都在印度获得了很好的发展
0,0,0,但是，我们还能够在互联网服务、初创公司投资和针对印度的物联网设备方面做更多事情
1,0,0,他补充称，小米印度业务并不需要大量的外部投资，因为它本身就是盈利的业务
1,0,0,小米在印度打造了一系列互联网服务，包括音乐应用程序MiMusic和文件共享应用MiDrop以及MiBrowser浏览器和MiStore购物应用
0,0,0,最近，该公司还在印度推出了贷款应用MiCredit，提供最高10万卢比的贷款
1,1,0,小米已在印度投资了10个初创公司，其中几家初创公司符合其打造互联网服务的战略，例如社交网络应用Sharechat、数字内容平台Hungama和借贷初创公司Krazybee
0,0,0,而且，它还与这些公司合作推出了相关的产品
1,0,0,目前，科技巨头谷歌、Facebook、Paytm和亚马逊等已打造了完善的服务生态系统，并在各个行业进行了投资
1,0,0,小米似乎准备效仿苹果，为其硬件用户打造一系列服务
0,0,0,印度Quo-tient公司联合创始人阿南德-卢尼亚AnandLunia说
0,0,0,随着其手机的推广，小米将能够更深入地了解消费者，从而在手机中整合更好的服务
0,0,0,他补充说
1,0,0,小米还准备进军高端智能手机市场
1,0,0,业内专家称，小米在印度销售的几乎所有手机都在3万卢比价格之下
0,0,0,它的唯一一款高端智能手机是MiMix
0,0,0,我们意识到现在是时候进军高端智能手机市场了
0,0,0,我们必须主动挑选我们的战场，自觉地进行决策
0,0,0,如果我们想在印度获胜，我们就不能距离平均销售价格太远
0,0,0,贾马库说
0,0,0,很多印度消费者都开始购买他们的第二部或第二部智能手机
0,0,0,我们不能让他们失望
0,0,0,他补充说
1,0,0,小米印度公司已宣布将会在8月8日推出MiA2AndroidOne智能手机，但是尚未公布它的价格
0,0,0,贾马库还表示，他们还会进一步发展小米官网Mi.com
0,0,0,目前，就GMV网站成交金额而言，小米官网已成为了印度第三大网站
0,0,0,我们估计，就GMV而言，我们在网络销售方面已成为印度第三大平台
0,0,0,他说
0,0,0,Mi.com网站团队打造了很多功能，例如交换、MiProtect服务和城区当日送达服务以及多个商品捆绑打折优惠
1,0,0,贾马库称，小米将会继续通过Flipkart和亚马逊等平台销售其产品
1,0,0,在中国，我们除了在小米官网销售产品外，我们还在阿里巴巴和京东进行销售
0,0,0,但是同时，我们也会与它们进行竞争，例如我们的MiPay就与支付宝形成了竞争
0,0,0,他解释说
1,0,0,市场研究公司Counterpoint的最新统计数据显示，第二季度，在印度，小米被三星夺走了智能手机销量冠军的宝座
0,0,0,而在此前两个季度，小米一直是印度市场上的智能手机销量冠军
0,0,0,保持第一至关重要
0,0,0,但是，一个季度不是第一并不会让我们睡不着觉
0,0,0,他说
1,0,0,小米还致力于通过其线下渠道如小米之家零售店或其他合作伙伴来提高销售额
0,0,0,该公司还计划到明年底将其线下销量占比提高到其全部销量的50%
0,0,0,编译/乐学
,,,;;;;;;;;;;
0,1,0,网易科技讯8月7日消息，据路透社报道，四位消息人士透露，阿里巴巴计划合并快餐外卖部门，并为新部门融资，加强与美团在中国发展迅速的按需服务市场上的竞争
0,1,0,其中一位人士称，融资预计在今年晚些时候进行，新合并的部门将包括阿里巴巴的盒马鲜生
0,1,0,阿里巴巴要合并的部门包括外卖平台饿了么和口碑的美食及时尚生活服务
0,1,1,一位消息人士称，阿里巴巴希望为合并后的新实体融资30-50亿美元，另一位人士表示，新实体估值最高可达250亿美元
0,1,0,对此阿里巴巴拒绝置评，饿了么的发言人否认存在合并和融资计划
0,0,0,由于此消息未公开，所有消息人士都拒绝透露身份
0,0,0,易观国际称，去年中国O2O交易额增长72%至1460亿美元
0,0,0,据艾媒咨询6月的报告称，饿了么和百度外卖第一季度占据中国外卖市场的55%，美团外卖占41%
0,0,0,4月滴滴也推出了自己的外卖服务
0,0,0,美团将在数月内在香港上市，预计募集超40亿美元
0,0,0,在去年的融资中，美团估值达到300亿美元
,,,;;;;;;;;;;
0,0,0,凤凰网科技讯据BusinessKorea北京时间8月7日报道，在苹果公司市值最近突破10000亿美元之际，三星电子的市盈率已经跌至6倍
0,0,0,更低的市盈率常常意味着更大的股价上涨潜力，但在现实中三星电子的股价却不断下跌，主要原因就是该公司的业绩前景不够稳定，尤其是业界担心其半导体业务面临下行的风险
0,0,0,根据韩国交易所的数据，三星电子股价上周五收报45750韩元，较上一交易日上涨0.44%或200韩元
0,0,0,然而在盘中，三星电子股价一度跌至45450韩元，差点跌破45000韩元关口
0,0,0,自5月初三星电子股票拆分后，该股就一路下滑，较拆股后的53000韩元下跌了13.67%
0,0,0,三星电子第二季度的运营利润为14.87万亿韩元约合131.8亿美元，让此前连续七个季度盈利创下记录的势头划上终结
0,0,0,这一不及预期的表现对其股价产生了不利影响
0,0,0,三星电子近期宣布派发公司有史以来最高的股息，但市场却给出了冷淡的反应
0,0,0,一些证券公司甚至表示，股利基金应该减少持有的三星电子股份
0,0,0,最近两到三年，股权基金通过增持三星电子等大盘股而提高了收益率
0,0,0,事实上，在韩国，有162支基金的最大头寸是三星电子，其中有106支基金持有的三星电子股份占其投资组合的逾10%
0,0,0,直到去年上半年，他们还通过三星电子保持了很高的回报率，即便该公司的派息率很低
0,0,0,然而，情况在最近发生了变化
0,0,0,例如，持有三星电子股份头寸最高的KBResearchHighDividendSecurities基金过去一年来的回报率为负6.65%，过去三个月的回报为负11.41%
0,0,0,这是因为，在一些市场研究人员警告半导体繁荣周期即将结束后，三星电子的股价出现下跌
0,0,0,相比之下，作为三星电子在智能手机市场的头号竞争对手，苹果的市值不断飙升
0,0,0,苹果不久前成为美国首支市值突破10000亿美元的公司
0,0,0,该股在上周五收报207.99美元，涨幅为0.29%
0,0,0,自从在7月31日公布第二季度业绩后，苹果股价每天都在上涨
0,0,0,从市盈率来看，三星电子股价上涨的可能性要高于苹果，但现实并非如此
0,0,0,根据DBFinancialInvestment的数据，三星电子的市盈率目前为6.4，低于韩国综合股价指数平均的9.4倍
0,0,0,另一方面，苹果的前瞻市盈率为15.7倍，是三星电子的两倍多
0,0,0,市盈率是股价与每股收益之间的比率，市盈率较低意味着市值遭到低估
0,0,0,换句话说，在正常情况下，三星电子的股价未来将会上涨，因为该公司的市盈率不仅低于苹果，也低于韩国股市的其他许多公司
0,0,0,然而，市盈率只是估值的标准之一，企业盈利前景黯淡才是三星电子真正的症结
0,0,0,这主要是由于不稳定的半导体市场前景造成的，该业务贡献了三星电子78.6%的运营利润
0,0,0,市场研究公司DRAMeXchange预计，NAND闪存芯片的价格将持续下跌至明年上半年
0,0,0,因此，三星电子的企业利润未来将进一步下降
0,0,0,相比之下，虽然iPhone占据了苹果总营收的60%，但苹果应用商店、苹果支付、iTunes和iCloud等服务业务第二季度的营收同比大增了31%
0,0,0,随着苹果成功地实现了收入多元化，该公司正受到市场的正面评价
0,0,0,编译/扬帆
,,,;;;;;;;;;;
0,0,0,凤凰网科技讯据金融时报北京时间8月7日报道，软银集团周一公布了第一财季财报，营业利润同比增长49%
0,0,0,在周二早盘交易中，软银股价大涨近7%
0,0,0,软银CEO孙正义
0,0,0,在利好财报推动下，软银股价在今天早盘交易中突破1万日元
0,0,0,截至东京时间周二11时07分北京时间周二10时07分，软银股价上涨632日元至10
0,0,0,在此之前，彭博社引用匿名消息人士的话称，软银寻求为其无线网络部门的首次公开招股IPO获得900亿美元的估值
0,0,0,软银股价今天上涨近7%
0,0,0,软银第一财季的大部分利润增长来自其规模为1000亿美元的愿景基金
0,0,0,软银第一财季营业利润为7150亿日元，其中愿景基金贡献了2300亿日元
0,0,0,同时，愿景基金的大部分营业利润来自其以40亿美元向沃尔玛出售印度电商公司Flipkart的股份
0,0,0,愿景基金在去年8月投资25亿美元获得了这部分Flipkart股份
0,0,0,软银创始人兼CEO孙正义MasayoshiSon周一称，公司大部分利润增长来自愿景基金，但是今天的利润只是我们将在未来取得利润的一小部分
0,0,0,编译/箫雨
,,,;;;;;;;;;;
1,1,1,新浪科技讯?北京时间8月7日下午消息，据知情人士透露，软银旗下的愿景基金VisionFund计划领投阿里巴巴旗下食品派送巨头饿了么新一轮融资，此轮融资规模在30亿到50亿美元之间
0,1,0,知情人士称，孙正义领导的近1000亿基金正与潜在投资者进行讨论、作为协议一部分，阿里巴巴打算将饿了么与公司内部部门口碑合并，后者旨在将餐厅与互联网相连
0,0,0,协商正在进行中，条款或可不时发生变化
0,1,0,这笔融资将为饿了么带来急需的资金注入
1,1,0,在于阿里巴巴的对手腾讯投资支持的美团大众点评的竞争中，饿了么已经消耗大量资金
0,1,0,阿里巴巴收购饿了么之时，公司估值达95亿美元
0,1,0,虽然目前的投资能获得饿了么多少股份仍不可知，但投资者至少可以分得未来潜在上市公司的一杯羹
0,1,0,为了吸引用户争夺市场份额，饿了么和美团均不惜一切代价提供大幅折扣，从而遭受巨额损失
0,0,0,虽然消费者的价格降低了，但两家公司仍须向骑手大军付款
1,0,0,这次投资将来自软银的愿景基金
0,0,0,这家规模巨大的基金旨在投资全球最具影响力的公司，以谋取未来技术领域的优势地位
1,1,0,而从个人层面上来看，软银亦是阿里巴巴最早期的投资者之一，孙正义本人也是马云的好友，分别在对方的公司拥有董事席位
0,0,0,随着越来越多人使用智能手机订餐、预订美容护理项目和钟点工，中国的按需服务市场发展迅速
0,0,0,对于想要进一步推广各自支付服务的阿里巴巴和腾讯来说，这个市场也具有重要战略意义
0,0,0,外媒路透社率先报道了融资金额和合并计划
0,1,0,阿里巴巴拒绝代表饿了么发表评论
0,0,0,软银发言人拒绝置评
0,0,0,木尔
,,,;;;;;;;;;;
0,0,0,腾讯科技讯据外媒报道，正通过借助发行新流通股或现金置换所有DVMT股票的交易重返证券市场的戴尔公司，通过周一提供的财务数据让投资人对其财务状况有了更深入的了解
0,0,0,戴尔在周一提交给美国证券交易委员会的代理须知proxystatement中表示，预计公司2019财年的营收将增长约9.5%，达到875亿美元，高于去年同期的799亿美元
0,0,0,调整后未计入利息、税费、折旧和摊销之前的净利润预计较上年的82亿美元增长18%，达到97亿美元
0,0,0,上述数据均包括来自于所持VMware股权的财务收益
0,0,0,戴尔发布的这份代理须知，包括交易背景，以及截至2023财年的财务预期
0,0,0,它也是自戴尔在2013年进行私有化以来，时间跨度最长的业绩预期
0,0,0,这些信息对戴尔通过反常规的交易，即收购与VMware相关的跟踪股票重返证券市场至关重要
0,0,0,在戴尔上月初宣布通过发行新流通股或现金置换所有的DVMT股票进行上市之后，投资人越来越怀疑这家公司将如何以每股109美元的现金，或者是戴尔C类股票置换DVMT股票
0,0,0,此交易的总价高达217亿美元
0,0,0,消息人士上月透露，部分DVMT股票的持有人对戴尔提出的交易感到迷惑不解，因为此交易对戴尔C类股票的估值为79.77美元，意味着该价格较去年11月时的33.17美元上涨了140%
0,0,0,包括卡尔-伊坎CarlIcahn和知名对冲基金ElliottManagement都在等待戴尔在代理须知中提供更多关于交易的信息
0,0,0,投资者急迫的希望看到戴尔如何预测其财务表现，因为这些数据被用来评估公司和交易价格
0,0,0,举例来说，戴尔预计2019财年营收将增至865亿美元至885亿美元，高于先前预计的827亿美元
0,0,0,公司2022财年营收将在995亿美元至1033亿美元，略高于此前预计的999亿美元
0,0,0,DVMT追踪股票是为了帮助戴尔在2016年斥资670亿美元收购存储巨头EMC而设立
0,0,0,当时的交易大部分通过现金完成，但一小部分通过与EMC持有的VMware股份关联的DVMT追踪股票来支付
0,0,0,戴尔此前表示，该公司将用新创建的C级股票置换DVMT追踪股票V级股票
0,0,0,戴尔称，DVMT追踪股票的股东可选择接受每股109美元的收购报价，或者是每股置换1.3665股C级股票
0,0,0,戴尔的C级股票将在纽交所挂牌交易
0,0,0,持有戴尔公司72%流通股的创始人、大股东迈克尔-戴尔MichaelDell，仍将担任公司董事会主席兼首席执行官，在2013年参与戴尔私有化交易的私募公司银湖仍将持有戴尔的少数股权
0,0,0,戴尔决定重返证券市场，部分源自于公司的服务器业务正在成长，且PC业务保持平稳
0,0,0,戴尔公司目前是全球最大的私有科技公司，在2015年举债完成670亿美元收购EMC的交易之后，虽然该公司已逐步把债务减少了约100亿美元，但仍负债累累的戴尔寻求通过交易获得新增长途径
0,0,0,收购EMC的交易，并没有让戴尔实现规划的削减成本和业绩目标
0,0,0,与此同时，配件价格的上涨和数据存储市场的形势，腐蚀了戴尔的利润率
0,0,0,该公司目前在提升盈利能力这一问题上面对着非常大的压力
0,0,0,美国去年年底税改方案的推出，加之利率上升的风险加大，为筹措更多现金带来更大的压力，可能加剧戴尔的债务负担
0,0,0,戴尔借助收购DVMT股票重返证券市场的目的，是为了减少公司沉重的债务负担，让公司有能力通过公开市场募集资金继续进行收购
0,0,0,戴尔此前曾考虑通过反向收购上市附属公司VMware，让公司重返证券市场
0,0,0,反向收购VMware，将能够让戴尔获得前者账面的116亿美元现金，帮助其削减账面上525亿美元的债务
0,0,0,戴尔通过收购EMC获得了VMware82%的股权
0,0,0,在收购DVMT追踪股票之后，VMware仍将是一家独立公司
0,0,0,编译/明轩
,,,;;;;;;;;;;
0,0,0,新浪科技讯8月7日下午消息，今日，有媒体发布暴风集团市值不到35亿冯鑫和公司高管纷纷减持文章，并在网络上得到了转载和传播，对此，暴风集团发布声明称，文章标题和正文中提到的冯鑫减持暴风集团股票与事实不符
0,0,0,根据媒体文章信息，8月3日，暴风集团发布公告称，公司三个首发股东均为有限合伙企业拟以集中竞价的方式，减持不超过公司总股本0.78%的股份，即合计不超过258.64万股
0,0,0,而冯鑫是三家合伙企业的普通合伙人，且是三家公司唯一执行事务合伙人，根据法律规定，执行事务合伙人必须由普通合伙人担任，其职务相当于公司的法人代表
0,0,0,由此得出冯鑫与暴风高管都将在本次减持计划中抛售股份
0,0,0,暴风方面发表声明表示，冯鑫在三家企业中持有很少的份额
0,0,0,冯鑫本人声明不会在本次减持计划中减持在三家合伙企业中的份额，也不会减持暴风集团股份
0,0,0,声明还称，自2015年3月上市至今，冯鑫从未减持过任何个人直接或间接持有的上市公司股份
0,0,0,以下为关于媒体报道冯鑫减持暴风集团股份的声明
0,0,0,我们注意到部分媒体于8月7日发布了标题为暴风集团市值不到35亿冯鑫和公司高管纷纷减持的媒体文章，并在网络上得到了转载和传播
0,0,0,文章标题和正文中提到的冯鑫减持暴风集团股票与事实不符，特此声明
0,0,0,文章中提到的三家合伙企业瑞丰利永、融辉似锦和众翔宏泰是暴风集团的员工持股平台
0,0,0,冯鑫作为三家合伙企业的普通合伙人，在三家企业中持有很少的份额
0,0,0,冯鑫声明不会在本次减持计划中减持在三家合伙企业中的份额，也不会减持暴风集团股份
0,0,0,自2015年3月上市至今，冯鑫从未减持过任何个人直接或间接持有的上市公司股份
0,0,0,请广大媒体和投资人关注事实，避免被不实信息误导
0,0,0,暴风集团
0,0,0,2018年8月7日
,,,;;;;;;;;;;
0,0,0,凤凰网科技讯北京时间8月7日消息，HTC公司TWSE 2498今天发布了截至6月30日的2018财年第二季度及上半年合并财报
0,0,0,财报显示，HTC第二季度营收为67.74亿元新台币，下同约合2.21亿美元，较上年同期的161亿元下降58%
0,0,0,税后净亏损为20.85亿元约合6800万美元，较上年同期的税后净亏损20亿元扩大5%
0,0,0,HTC股价表现
0,0,0,HTC周二的开盘价为54元
0,0,0,截至北京时间周二11点15分，HTC股价下跌3.50元至51.90元，跌幅为6.32%
0,0,0,过去52周，HTC股价最高为83.70元，最低为50.30元
0,0,0,第二季度业绩要点
0,0,0,——营收为67.74亿元约合2.21亿美元，较上年同期的161亿元下降58%
0,0,0,——毛利率为2.7%，较上年同期的13.7%下降11个百分点
0,0,0,——营业亏损34.36亿元约合1.12亿美元，较上年同期的营业亏损22亿元扩大55%
0,0,0,营业利润率为-50.7%，上年同期为-13.6%
0,0,0,——税后净亏损为20.85亿元约合6800万美元，较上年同期的税后净亏损20亿元扩大5%
0,0,0,——每股亏损2.53元约合0.08美元，较上年同期的每股亏损2.37元扩大7%
0,0,0,上年业绩要点
0,0,0,——营收为155.63亿元约合5.08亿美元
0,0,0,——营业亏损为83.40亿元约合2.72亿美元
0,0,0,——税后净利润为190.04亿元约合6.20亿美元
0,0,0,——每股收益为23.19元约合0.76美元
0,0,0,编译/箫雨
,,,;;;;;;;;;;
0,1,1,凤凰网科技讯据华尔街日报北京时间8月8日报道，北京字节跳动科技有限公司今日头条已经启动新一轮股权融资，对该公司的估值最高或达750亿美元
0,1,0,知情人士称，今日头条希望在融资中筹集30亿美元
0,0,0,这一数额有可能改变，且不能保证今日头条能够达到其目标估值
0,0,0,据一位消息人士说，最近有部分今日头条股份在私下交易中被换手，对该公司的估值已达620亿美元
0,1,0,而在2017年底的一轮融资中，今日头条的估值约为300亿美元
0,1,0,750亿美元的估值将让今日头条成为全球最具价值的私营科技公司之一，超过网约车巨头Uber和滴滴出行
0,1,0,今日头条的估值仍低于马云的金融科技公司蚂蚁金服，后者在最近的融资中估值1500亿美元
0,0,0,最近数月，多家中国科技公司获得了极高的私有估值，其中许多公司计划在未来一年上市
0,0,0,但在小米集团上月表现平平的首次公开募股IPO之后，投资者、投行和企业家一直在密切关注着私有和公开估值
0,1,0,今日头条在最新融资中的表现，可能将是一个重要信号
0,0,0,成立于六年前的字节跳动拥有新闻聚合应用今日头条、短视频应用抖音
0,0,0,去年，该公司收购了美国短视频应用Musical.ly，并在上月将其与抖音海外版应用TikTok合并
0,0,0,知情人士透露，今日头条预计将利用筹集的资金在全球扩张，同时打造国内应用
0,0,0,迄今为止，该公司筹集的资金大多来自国际投资者，其中包括风险投资公司红杉资本SequoiaCapital、私募股权公司GeneralAtlantic和KKR&Co等
0,1,0,今日头条的现有投资者还包括中国投资公司高瓴资本等
0,1,0,知情人士说，今日头条在本轮融资中也联系了国际投资者
0,1,0,今日头条此时开展融资，可能是该公司在香港进行数十亿美元IPO的前奏
0,1,0,华尔街日报上月报道称，今日头条可能在今年或明年上市
0,0,,编译/扬帆
,,,;;;;;;;;;;
0,0,0,网易科技讯8月8日消息，SnapNASDAQ SNAP今天公布了截至6月30日的2018财年第二季度财报
0,0,0,报告显示，公司该季度营收为2.62亿美元，去年同期为1.82亿美元，同比增长44%
0,0,0,按美国通用会计准则计GAAP，净亏损为3.53亿美元，去年同期为净亏损4.43亿美元
0,0,0,合摊薄后每股亏损为0.27美元，去年同期为每股亏损0.36美元
0,0,0,其他数据
0,0,0,·日均活跃用户数DAU为1.88亿人，同比1.73亿，环比2%
0,0,0,·运营亏损为3.58亿美元，去年同期为亏损4.49亿美元
0,0,0,·调整后未计利息、税项、折旧及摊销前的亏损EBITDA为1.69亿美元，去年同期为亏损1.94亿美元
0,0,0,·现金、现金等价物以及有价证券共计15.70亿美元，上财年末为20.43亿美元
0,0,0,作者
0,0,0,EditorAI
,,,;;;;;;;;;;
0,0,0,腾讯科技讯继周四突破万亿美元市值后，苹果周五盘中高点、收盘价双创新高
0,0,0,盘中高点达208.74美元，收盘价报207.99美元，上涨0.29%，创历史收盘新高，市值达10045.76亿美元
0,0,0,本周四，苹果成为了首家市值达到1万亿美元的美国上市公司
0,0,0,亚特兰大SynovusTrust投资经理丹尼尔·摩根DanielMorgan表示，苹果周五股价表现平平只是暂时的现象，并不意味着股价失去上涨动力
0,0,0,这就像是赛马冲过终点线，并宣称我已经大获全胜
0,0,0,摩根的公司持有20万股苹果股份
0,0,0,他同时表示
0,0,0,苹果周二发布了强劲的季度业绩
0,0,0,所有的关注点都是1万亿美元的市值，不过这两大热点耗尽了苹果目前的交易动力
0,0,0,即使市值已高达1万亿美元，苹果股票仍然不算贵
0,0,0,摩根的数据显示，苹果的未来12个月前瞻市盈率不到16倍，他认为苹果的市盈率可以达到18到19倍
0,0,0,他表示
0,0,0,这是个合理的水平，我不认为有任何风险
0,0,0,人们会说，苹果的市值已经1万亿美元，所以我们要刹车
0,0,0,但如果是亚马逊或者Netflix的市值达到1万亿美元，那么我们才需要进行这样的讨论
0,0,0,Netflix目前的12个月前瞻市盈率为93.8倍，而亚马逊为83.74倍
0,0,0,摩根表示
0,0,0,如果苹果的市盈率达到20倍，那么就会非常疯狂
0,0,0,他估计，苹果股价到年底可能会达到220美元
0,0,0,亚马逊、微软和Alphabet正在展开激烈竞争，都希望成为第二家市值达到1万亿美元的公司
0,0,0,汤森路透的数据显示，大部分卖方分析师也认为，1万亿美元市值只是苹果股价实现更大涨幅过程中的一个里程碑
0,0,0,目前，分析师给出的苹果目标股价的中位数为218.50美元，平均值为215.46美元
0,0,0,MonnessCrespiHardt分析师布莱恩·怀特BrianWhite给出的苹果目标股价最高，为275美元
0,0,0,这样的股价相当于市值1.3万亿美元
0,0,0,而怀特也是首个给出市值超万亿美元的苹果目标股价的分析师
0,0,0,怀特表示，尽管苹果的市值创纪录，但仍然是全球最被低估的股票之一
0,0,0,孟菲斯GullaneCapital管理合伙人特里普·米勒TripMiller认为，苹果股价还应该高很多
0,0,0,他们非常依赖一款产品来获得大部分收入
0,0,0,我认为，这是苹果估值存在折价的原因
0,0,0,编译/陈桦
,,,;;;;;;;;;;
0,0,0,新浪科技讯北京时间8月8日早间消息，特斯拉首席执行官埃隆·马斯克ElonMusk本周二在Twitter上表示，正考虑将特斯拉私有化，最终决定尚待股东投票确认
0,0,0,如果私有化成功，这将成为该行业市值最高的一笔交易，可以将特斯拉从华尔街的视野中转移出来
0,0,0,我考虑以420美元的价格收购特斯拉公司，使其私有化
0,0,0,资金已有着落，马斯克在Twitter上写道
0,0,0,马斯克在Twitter上宣布私有化意向
0,0,0,以每股420美元计算，这笔交易的总值将达到720亿美元
0,0,0,马斯克在一系列推文中没有透露资金来源，不过他说投资者的支持已得到确认
0,0,0,马斯克
0,0,0,股东们可以以420美元出售股票，或者继续持股并私有化
0,0,0,马斯克
0,0,0,即使我们私有化了，我希望所有现有的投资者都能继续持有特斯拉股票
