﻿investor,investee,mount,sentence
0,0,0,从代工厂的估值定位分析，工业富联估值已略显偏高
0,0,0,不过在其上市之际，就不断强调自身工业互联网、智能制造的定位、并通过更改上市公司名称来强化这一种市场意识
0,0,0,后市工业富联的估值，就是在代工厂与工业互联网转型之间寻找平衡
0,0,0,按照传统代工厂估值，可能只有10倍pe，如工业富联母公司鸿海精密当前市盈率仅10倍
0,0,0,但工业富联此次上市的业务板块主要是工业互联网，如果富士康工业互联网转型成功，则市场估值有望上浮
0,0,0,方正证券在研报中分析称，工业富联2018~2020年归母净利润将分别为186.56亿、218.57亿和255.56亿元，对应EPS为0.41、0.49和0.57元
0,0,0,考虑到公司是工业互联网+先进制造领域稀缺龙头级标的，按照2018年净利润20~25倍市盈率，合理的市值区间应该为3731亿~4664亿元
0,0,0,而申万宏源证券分析师骆思远此前曾预测，工业富联2018年~2020年营收分别为3879亿元、4265亿元、4697亿元，净利润分别为195亿元、236亿元、287亿元，增速分别为22.7%、21.5%、21.2%
0,0,0,工业富联发行市值2712亿元，A股电子制造业龙头企业2018年平均估值23倍，考虑公司稀缺性及成长潜力，给予6个月目标估值25倍
0,0,0,根据估算，2018年25倍的市盈率也就意味着工业富联约4875亿元的总市值，折合每股股价24.75元
0,0,0,另据媒体报道，有分析人士指出，工业富联的估值是在制造工厂与工业互联网转型之间寻求平衡
0,0,0,若以传统工厂估值，工业富联的市盈率应在10倍左右
0,0,0,但工业富联此次IPO意在募资用于工业互联网平台构建、云计算及高效能运算平台、高效运算数据中心、通信网络及云服务设备等八大颇具概念的项目，其发行市盈率为17.09倍，今日收盘市盈率23.15倍
,,,;;;;;;;;;;
0,0,0,新浪财经讯6月20日消息，早盘中兴通讯股价再度跌停，截止发稿，中兴通讯报18.49元，市值755亿元
0,0,0,早盘中兴通讯H股扭转跌势，涨3.7%
0,0,0,昨日中兴通讯报20.54元开盘跌停，封单高达532.9万手
0,0,0,短期内，受巨额罚款及人事变动等影响，中兴通讯业绩将受到冲击
0,0,0,长期看，中兴事件又是一个契机，有望加速我国通信产业未来占领技术高地和实现国产化替代
0,0,0,基金公司左右为难
0,0,0,此前多家基金调低中兴通讯估值的红线将被一一击穿，令基金陷入囚徒困境——如果基金不再度调低估值，对中兴通讯后市悲观的基民有可能会通过赎回基金来实现止损
0,0,0,但如果调低估值的话，到底估值底在哪里
0,0,0,估值底屡被击穿
0,0,0,根据此前整理的统计显示，复牌前共有39家基金公司旗下的基金调低了中兴通讯的估值，其中，部分基金公司设置的股价估值底为25.36元至20.54元不等，目前已经被陆续击穿，而其余将估值底设在20.04元的数家基金公司，如果不出意外，也将被新的跌停板击穿
0,0,0,对于基金持有人来说，当估值底被击穿后，一个新的抉择也就摆在面前
0,0,0,从目前盘面情况来看，巨量的跌停板封单和稀少的成交量，以及中兴通讯港股遥遥领先于A股的跌幅，意味着中兴通讯A股还存在跌停的可能，如果所持有的基金重仓中兴通讯，其净值损失难以测算，那么，是趁着没有新的估值调整前止损赎回，还是坐等反转
0,0,0,这是一个不容易做出的选择
0,0,0,黑天鹅带来烦恼
0,0,0,事实上，这已经不是第一次基金扎堆重仓个股遭遇黑天鹅了
0,0,0,近年来，多只基金重仓股踩雷，复牌后大幅暴跌，公募基金调低的估值多次被轻易击穿，让基金的操作陷入一次又一次的尴尬之中
0,0,0,上海某资深基金经理认为，伴随着公募基金在A股市场中份量的降低，近些年来公募基金屡屡采用抱团取暖、扎堆重仓的方式来捧高个股，表面上来看，净值得到了提升，但代价却往往是流动性风险巨大
0,0,0,一旦出现风吹草动，抱团取暖有可能会变成踩踏，导致股价实际跌幅会远远超出预期
,,,;;;;;;;;;;
0,0,0,TechWeb报道6月26日消息，乐视网今日开盘涨停，报3.69元，涨幅为10.15%，目前总市值为147.2亿元
0,0,0,昨天，恒大集团正式宣布以67.46亿港元收购香港时颖公司100%股份，间接获得SmartKing公司45%的股权，成为公司第一大股东
0,0,0,而这也意味着恒大正式入主美国新能源汽车公司FaradayFuture
0,0,0,根据恒大健康公告内容显示，香港时颖公司与FaradayFuture原股东以合资模式共同设立了一家新公司SmartKingLtd.，目标公司同意出资20亿美元，以获取于合资公司的45%股权经全部摊薄后
0,0,0,而FaradayFuture原股东以FaradayFuture集团拥有的技术资产及业务入股，获取于合资公司的33%股权经全部摊薄后
0,0,0,合资公司剩余之22%股权经全部摊薄后将预留作为根据股权激励计划配发予雇员的股权
0,0,0,于本公告日期，目标公司于2018年6月18日已获得美国外国投资委员会CFIUS通知其已完成审阅相关交易，包括收购事项
0,0,0,之后，法拉第未来官方微博也发布公告称，正式通过美国政府CFIUS审批，完成20亿美元首轮融资，创始人贾跃亭亲任首席执行官
0,0,0,同时，FF将采用AB股模式，贾跃亭作为创始人和CEO享有1股10票权利，在加州和广州设工厂，中美两地同步时布局、同步推行
0,0,0,此外，今天开盘，恒大健康股价也直线拉升
0,0,0,截至发稿，恒大健康报价6.07港元，涨幅为31.67%
0,0,0,老喵
,,,;;;;;;;;;;
0,0,0,网易科技讯6月21日消息，据路透社报道，五大科技公司FAANG中的四家——Facebook、Alphabet、亚马逊和Netflix——美国时间周三纷纷飙升至历史新高，只有苹果拖了后腿
0,0,0,这五支重量级股票也推动纳斯达克综合指数创下历史新高，并帮助标普500指数摆脱市场对美国和中国贸易战的担忧情绪的影响
0,0,0,由于市场对贸易战争的担忧，标普500指数今年以来的涨幅只有3.5%
0,0,0,但在此期间，业务基本不受贸易和关税影响的FAANG涨幅达到该指数的10倍
0,0,0,我们可以看到全球贸易存在着巨大的疑问……不管什么时候，每当市场陷入困境，寻找市场的领导力量和鉴别出强势力量总是很重要的
0,0,0,纽约投资公司50ParkInvestments首席执行官亚当沙尔汗AdamSarhan指出
0,0,0,目前，FAANG股票处于领涨地位，表现非常出色
0,0,0,包括五支核心FAANG股票的NYFANG指数周三也创下历史新高
0,0,0,Facebook股价一度大涨3.1%，至203.55美元，创下新高，并首次突破200美元大关
0,0,0,谷歌母公司Alphabet股价上涨1.9%，至1201.49美元，打破了1月29日创下的1198美元的纪录
0,0,0,亚马逊股价上涨1.6%，至1762.93美元，连续第三个交易日刷新历史新高
0,0,0,流媒体视频服务Netflix股价大涨3.5%，至419.17美元，这是该公司首次突破400美元关口
0,0,0,苹果盘中最高触及187.20美元，但仍比6月7日创下的194.20美元纪录低出3.7%
0,0,0,即使在这几支重量级股票当中，也有明显跑赢的赢家
0,0,0,Netflix进入2018年以来已经飙升了约120%，涨幅达到表现第二好的亚马逊大约上涨50%的两倍多
0,0,0,排在第三位的是Facebook，该社交网络巨头因为出现大规模数据泄露丑闻一度暴跌，而后逐渐收复失地，今年以来上涨了约14%
0,0,0,紧随其后的是Alphabet，增长了11.5%
0,0,0,排在最后的是苹果，增幅约为7%
0,0,0,投资者对新款iPhone需求放缓的持续担忧，拖累了苹果今年的股价走势
0,0,0,美银美林的一项调查显示，5月，FAANG连续第五个月成为交易量最大的几支股票
0,0,0,乐邦
,,,;;;;;;;;;;
0,0,0,凤凰网科技讯北京时间6月20日消息，甲骨文今天发布其结束于2018年5月31日的2018财年第四季度及全年财报
0,0,0,财报显示，基于美国通用会计准则GAAP，以下简称GAAP，甲骨文第四财季总营收为112.51亿美元，与上年同期的108.92亿美元同比增长3%
0,0,0,净利润为34.08亿美元，较上年同期的32.31亿美元增长5%
0,0,0,图
0,0,0,甲骨文
0,0,0,2018财政年度，基于GAAP，甲骨文总营收为398.31亿美元，与上一财年的377.28亿美元相比增长6%
0,0,0,净利润为38.25亿美元，比上一财年的93.95亿美元减少59%
0,0,0,图
0,0,0,甲骨文股价截图
0,0,0,周二美股收盘，甲骨文股价跌0.25美元，收于46.27美元，跌幅为0.54%
0,0,0,在盘后交易中，截至发稿，甲骨文股价跌0.1.52美元，跌幅为3.29%，暂报44.75美元
0,0,0,过去52周中甲骨文股价浮动范围
0,0,0,44.04美元-53.48美元
0,0,0,以下为甲骨文第四财季主要财务数据
0,0,0,总营收
0,0,0,基于GAAP，甲骨文第四财季总营收为112.51亿美元，与上年同期的108.92亿美元同比增长3%
0,0,0,基于非美国通用会计准则Non-GAAP，以下简称Non-GAAP，总营收为112.60亿美元，比去年同期的109.42亿美元增长1%
0,0,0,其中云服务和许可支持业务营收为67.70亿美元，同比增长8%，在总营收中所占比例为60%
0,0,0,去年同期，甲骨文云服务和许可支持业务营收为62.58亿美元，在总营收中所占比例为58%
0,0,0,云许可和本地许可业务营收为24.83亿美元，比去年同期下滑5%，在总营收中所占比例为22%
0,0,0,去年同期云许可和本地许可业务营收为26.26亿美元，在总营收中占比为24%
0,0,0,硬件业务营收为11.15亿美元，与去年同期持平，在总营收中所占比例为10%
0,0,0,去年同期硬件营收为11.14亿美元，在总营收中所占比例107%
0,0,0,服务业务营收为8.83亿美元，同比下降1%，在总营收中所占比例为8%
0,0,0,去年同期服务业务营收为8.94亿美元，在总营收中所占比例8%
0,0,0,净利润
0,0,0,基于GAAP，净利润为34.08亿美元，较上年同期的32.31亿美元增长5%
0,0,0,每股基本和摊薄收益分别为0.84美元和0.82美元，上年同期分别为0.78美元和0.76美元
0,0,0,基于Non-GAAP，净利润为40.87亿美元，去年同期为37.62亿美元同比增长7%
0,0,0,每股摊薄收益0.99美元，去年同期为0.89美元，同比增长9%
0,0,0,运营利润及运营利润率
0,0,0,基于GAAP，运营利润为43.80亿美元，比上年同期的40.73亿美元增长5%
0,0,0,运营利润率为39%，上年同期为37%
0,0,0,基于Non-GAAP，运营利润为52.98亿美元，比上年同期的50.16亿美元增长4%
0,0,0,运营利润率为47%，高于去年同期的46%
0,0,0,现金流
0,0,0,截至第四季度末，甲骨文短期递延收入增长2%至84亿美元，而经营现金流量在过去12个月的基础上增长9%，即13亿美元，达到创纪录的154亿美元
0,0,0,季度派息
0,0,0,甲骨文董事会宣布，每股在外流通普通股季度现金股息为0.19美元
0,0,0,该股息将支付给2018年7月17日持股股东，到账日为2018年7月31日
0,0,0,甲骨文2018财年主要财务数据
0,0,0,总营收
0,0,0,基于GAAP，甲骨文总营收为398.31亿美元，与上一财年的377.28亿美元相比增长6%
0,0,0,基于Non-GAAP，甲骨文总营收为398.78亿美元，与上一财年的378.99亿美元相比增长5%
0,0,0,净利润
0,0,0,基于GAAP，净利润为38.25亿美元，比上一财年的93.95亿美元减少59%，每股摊薄收益0.90美元，较上一财年的2.21美元下降59%
0,0,0,基于Non-GAAP，净利润为132.44亿美元，比上一财年的115.59亿美元增长15%
0,0,0,每股摊薄收益为3.12美元，较上一财年的2.74美元增长14%
0,0,0,运营利润及运营利润率
0,0,0,基于GAAP，运营利润为136.79亿美元，较上一财年的127.10亿美元增长8%
0,0,0,运营利润率为34%，与上年同期持平
0,0,0,基于Non-GAAP，运营利润为175.70亿美元，较上一财年的161.67亿美元增长9%
0,0,0,运营利润率为44%，上年同期为43%
0,0,0,高管点评甲骨文公司CEO萨夫拉·卡茨SafraCatz表示
0,0,0,去年，我预测公司2018财年每股non-GAAP收益将呈现两位数增长，今年我们实现增长14%，这主要得益于我们云业务的强劲增长
0,0,0,展望2019财年，我预计营收增长将确保每股non-GAAP收益实现两位数增长
0,0,0,甲骨文CEO马克·赫德MarkHurd表示
0,0,0,我们第四季度的表现非常出色，总营收比我们的预测高出2亿美元以上按不变货币价格计
0,0,0,第四季度，我们的FusionERP和HCMSaaS云应用套件营收增长超过了50%，我们预计在整个2019财政年度，FusionSaaS套件将继续保持强劲增长
0,0,0,甲骨文公司董事长兼首席技术官拉里·埃里森LarryEllison表示
0,0,0,我们的一些大客户现在已经开始将其内部部署的Oracle数据库迁移到Oracle云中
0,0,0,比如，AT&T正在将数千个数据库和数万TB的数据迁移到Oracle云中，我们认为，这些将数据从Oracle数据库转移至云的大规模迁移，将推动我们2019财年PaaS和IaaS业务的增长
0,0,0,编译/若水
,,,;;;;;;;;;;
0,0,0,新浪财经讯6月21日晚间消息，快乐购物股份有限公司发布公告称，收到证监会核发的关于核准快乐购物股份有限公司向芒果传媒有限公司等发行股份购买资产并募集配套资金的批复，公司重大资产重组正式获批通过，湖南广电旗下快乐阳光、芒果互娱、天娱传媒、芒果影视和芒果娱乐五家公司整体作价115亿打包注入快乐购
0,0,0,此次芒果TV成功实现借道上市，也将成为国内A股首家国有控股的视频平台
0,0,0,从2017年6月再启重组，湖南广电这部分优质资产拟注入快乐购的上市之路，已经持续了将近一整年的时间
0,0,0,此次资产重组中，近年来芒果系资产中势头强劲的芒果TV作价95.3亿成为核心标的，也是交易价格最高、对快乐购财务报表影响最大的部分
0,0,0,在目前国内视频行业平台普遍亏损的情况下，芒果TV实现逆势飘红，是为数不多实现盈利的
0,0,0,目前，芒果TV在内容制作、渠道拓展、平台运营、人才体制等方面已经形成了市场化程度高、运营模式成熟的全产业链生态
0,0,0,当然，芒果TV的最大优势是背靠湖南台
0,0,0,创建初期，依托于湖南台自制内容由芒果TV独家播出，芒果TV迅速发展
0,0,0,据快乐购公告显示，2017年芒果TV营业收入33.85亿元，相对于2016年的18.17亿元，增长幅度达86.3%
0,0,0,不可否认的是，湖南卫视和芒果TV在内容制作方面尤其是综艺类节目制作方面长期占据着国内引领地位
0,0,0,从芒果TV内容结构来看，头部内容和爆款内容占比大，对流量拉动能力强，其中较大部分来自自制内容
0,0,0,据统计，向往的生活、亲爱的客栈以及中餐厅三档节目为芒果TV斩获了超45亿的播放量
0,0,0,从2017年网综播放前十的数据上来看，2017年芒果TV在前10的播放量的节目中占据了5档，总计播放量超过90亿
0,0,0,据了解，交易完成后，快乐购上市公司将完成新媒体平台及内容的整合，主营业务将由媒体零售业务拓展至新媒体平台运营、新媒体互动娱乐内容制作及媒体零售全产业链等，进一步打造为国有新型主流媒体集团
0,0,0,快乐购此前发布的称，交易完成后，上市公司的总资产、净资产规模将大幅增加，营业收入、净利润都将大幅提高，盈利能力和综合竞争力将进一步增强
0,0,0,公开资料显示，快乐购组建于2005年，以电视购物起家，目前的主营业务有家庭消费业务、内容电商业务、O2O电商业务和消费金融业务，2017年，快乐购营业收入为29.8万元，同比减少7.32%，净利润为7253万元，同比增长9.03%
0,0,0,新浪财经徐雯
,,,;;;;;;;;;;
0,1,1,TechWeb报道6月25日消息，法拉第未来官方微博发布公告称，正式通过美国政府CFIUS审批，完成20亿美元首轮融资，创始人贾跃亭亲任首席执行官
0,0,0,同时，FF将采用AB股模式，贾跃亭作为创始人和CEO享有1股10票权利，在加州和广州设工厂，中美两地同步时布局、同步推行
0,0,0,在早些时候，恒大健康也披露，恒大集团以67.46亿港元收购香港时颖公司100%股份，于2018年7月3日或之前以现金一次性支付
0,0,0,同时，恒大也间接获得SmartKing公司45%的股权，成为公司第一大股东
0,0,0,而这也意味着恒大正式入主美国新能源汽车公司FaradayFuture
0,0,0,法拉第未来表示
0,0,0,感谢合作伙伴、供应商、员工和新投资者的耐心和帮助
0,0,0,同时，也欢迎恒大健康EvergrandeHealth成为我们的新战略投资者
0,0,0,我们在全球的1000多名员工将继续一道努力，以打破各行业界限，共享我们要打造的智能移动出行系统
0,0,0,不过，据内部人士透露称，贾跃亭并非在SmartKing中不受任何约束，贾跃亭实施原股东投票权的前提条件是FF在2018年底前实现量产，若未达到这一条件，则失去对SmartKing的实际控制，该原股东投票权将被回转到目标公司FF
0,0,0,现在，离年底只有半年的时间，贾跃亭在获得融资后，也不能完全懈怠，按时交付将是法拉第未来和贾跃亭当下最大的挑战
0,0,0,老喵
,,,;;;;;;;;;;
0,0,0,TechWeb报道6月26日消息，昨日晚间，万达电影发布公告称，公司拟以发行股份及支付现金的方式，向北京万达投资有限公司等万达影视传媒有限公司以下简称万达影视的21名股东购买其持有的万达影视96.8262%的股权，交易作价116.19亿元
0,0,0,股票暂不复牌
0,0,0,本次交易前，上市公司实际控制人王健林通过万达投资、万达文化集团持有上市公司?48.09%的股份
0,0,0,本次交易后，王健林通过万达投资、万达文化集团持有的上市公司的股权比例变化为?41.75%，王健林仍为上市公司的实际控制人
0,0,0,重组完成后，自去年5月份更名的万达电影，将真正意义上达成从院线到?电影公司的转型升级
0,0,0,公告显示，交易完成后，公司业务将主要从影院投资建设、院线电影发行、影院电影放映及相关衍生业务等影视行业产业链下游，扩展至电影和电视剧的投资、制作?和发行，以及网络游戏发行和运营领域，建成集院线终端平台、传媒营销平台、影视?IP?平台、线上业务平台、影游互动平台为一体的五大业务平台
0,0,0,公告数据显示，2016年万达影视净利润3.64亿元
0,0,0,2017年万达影视实现净利润5.97亿元，净利润率29.55%
0,0,0,2018年一季度，万达影视便实现净利润4.07亿元，净利润率上升至46.04%
0,0,0,万达投资承诺万达影视?2018?年度、2019?年度、2020?年度承诺净利润数分别不低于?8.88?亿元、10.69?亿元、12.71?亿元
0,0,0,2016年上半年，万达电影曾尝试收购万达影视，当时万达视整体估值超过370亿，当时的收购资产还包括传奇影业
0,0,0,2016年8月，万达电影发布公告称，因证券市场环境发生了较大变化，继续推进本次重大资产重组的条件不够成熟，中止重组
0,0,0,周小白
,,,;;;;;;;;;;
1,1,1,新浪科技讯北京时间6月26日上午消息，印尼力宝集团LippoGroup周二宣布，该集团以股票和股票挂钩票据的形式，向腾讯控股投资6280亿印尼卢比约合4435万美元
0,0,0,力宝集团在声明中表示，此项投资将通过集团的香港分支进行，有助于集团的数字化
0,0,0,腾讯目前是亚洲市值第二高企业
0,0,0,轶群
,,,;;;;;;;;;;
0,0,0,网易科技讯7月2日消息，据国外媒体报道，总部位于英国伦敦的投资公司Centricus，已经与中国公司招商局集团ChinaMerchantsGroup和SPFGroup建立了合作关系，成立一个规模达1000亿元人民币约合151.1亿美元基金，用于对科技公司的投资
0,0,0,这一消息是这三家公司星期天对外宣布的
0,0,0,这三家公司表示，该基金将主要用于对科技公司的投资和收购，而目标为投资或收购对象的科技公司主要在中国范围，但也包括在全球范围
0,0,0,三家公司共同发布的声明称，招商局集团旗下投资机构招商局资本投资有限责任公司和其它的中国投资者，将贡献这基金的40%
0,0,0,Centricus和资产管理公司SPFGroup将组建一个合资企业，该合资企业的任务是召集国际投资者
0,0,0,天门山
,,,;;;;;;;;;;
0,1,1,全球人工智能芯片领域首个独角兽企业寒武纪科技宣布，已经完成数亿美元的B轮融资
1,0,0,本次融资由中国国有资本风险投资基金、国新启迪、国投创业、国新资本联合领投，中金资本、中信证券投资&金石投资、TCL资本、中科院科技成果转化基金跟投，原股东元禾原点、国科投资、阿里巴巴创新投、联想创投、中科图灵继续跟投支持
0,1,0,B轮融资后，寒武纪科技整体估值达25亿美元，继续领跑全球智能芯片创业公司
0,1,0,寒武纪创始团队源自学术界，公司也延续了学术界开放、协作的精神
0,1,0,在终端领域，寒武纪以处理器IP授权的形式与全世界同行共享最新的技术成果，帮助全球客户能够快速设计和生产具备人工智能处理能力的芯片产品
0,1,0,寒武纪1A处理器Cambricon-1A是世界首款商用深度学习专用处理器，已服务数千万台智能手机，并已衍生出1A、1H、1M等多个型号，为全球数以亿计的各类终端提供强大的本地智能处理能力
0,1,0,2018年5月，寒武纪科技发布了寒武纪MLU100智能芯片Cambricon-MLU100，适用于视觉、语音、自然语言处理等多种类型的云端人工智能应用场景，不仅其本身可以高效完成多任务、多模态、低延时、高通量的复杂智能处理任务，还可以与寒武纪1A/1H/1M系列终端处理器完美适配，以端云协作的方式提供前所未有的智能应用体验
0,1,0,寒武纪科技表示，在新老投资人的助力下，将继续致力于将智能芯片的思想、技术和产品播撒到世界每个角落，让机器更好地理解和服务人类
,,,;;;;;;;;;;
0,0,0,网易科技讯7月2日消息，据国外媒体报道，当电动滑板车的热潮愈演愈烈之时，那些大名鼎鼎的硅谷科技公司会袖手旁观吗
1,1,0,英国金融时报援引消息人士称，谷歌母公司Alphabet已直接投资了电动滑板车服务公司Lime
1,0,1,这是该初创公司一轮3亿美元融资的一部分，投资方还包括谷歌风投GoogleVentures
0,1,0,虽然没有提到有多少资金流向了Lime，但据称谷歌风投的投资金额比其它参投者高，Alphabet也投入了同样的金额——所以说涉及了不少的资金
1,0,0,目前还不清楚Alphabet为何会如此大力地参与投资有关各方都拒绝置评
1,0,0,然而，这反映出Alphabet在核心的互联网和移动业务以外寻求业务多元化之时，对交通出行领域的兴趣日益浓厚
1,0,0,Alphabet旗下拥有自动驾驶汽车公司Waymo，智慧城市项目SidewalkLabs也涉足公共交通
1,0,0,此外Alphabet还有其他的投资，包括SpinLaunch太空货物弹射器，以及联合创始人拉里·佩奇LarryPage投资的KittyHawk飞行汽车
0,0,0,该公司显然预计私家车的使用将会明显减少，它对汽车以外的各种交通选择也有了更大的兴趣
0,0,0,如果谷歌想继续保持其作为科技行业不断壮大的一股力量的地位，那么这笔投资可能是必不可少的
1,0,0,不管Alphabet喜欢与否，其收入仍然依赖于谷歌的网络广告
0,1,0,投资Lime或许可以帮助减少其对广告业务的依赖
0,0,0,不过，它也面临着一些风险——谁也无法保证电动滑板车服务将继续蓬勃发展，尤其是考虑到旧金山等城市的居民可能会不满该类工具造成人行道和街道堵塞
0,0,0,乐邦
,,,;;;;;;;;;;
1,1,0,腾讯科技讯据外媒报道，金融大鳄索罗斯据悉参与认购小米61亿美元的香港IPO，认购少量小米IPO股票
1,0,0,CapitalGroup、高瓴资本分别认购约5亿与6亿美元的小米股份
0,1,0,在此之前，小米01810首日孖展认购融资认购45.52亿港元，以在港公开发售集资额23.98亿港元计，相当于超购仅约0.9倍
0,1,0,后来小米新股孖展认购融资认购屡传抽飞取消认购，但市场消息透露，公开发售部分仍获约10倍认购
0,1,0,以小米公开认购部分集资5%或约24亿港元计，散户认购资金仍达240亿港元
0,1,0,此前据外媒报道，李嘉诚、马云等中国富豪，对小米股票产生了浓厚兴趣
1,0,0,消息人士称，名震全球的长期华人首富李嘉诚计划认购价值3000万美元的小米股票
0,1,0,中国阿里巴巴集团的掌门人马云也准备买入小米股票，认购数量尚不详
0,1,0,外媒指出，李嘉诚认购小米股票，将给小米公司带来巨大帮助，因为李嘉诚是香港家喻户晓的传奇企业家，他的投资也会带来一定的示范效应，吸引香港普通大众未来购买小米股票
0,0,0,中国的富豪往往拥有隶属于个人的投资工具
0,1,0,据报道，李嘉诚投资小米的渠道是李嘉诚基金会，马云将会通过哪个渠道投资，尚不详
,,,;;;;;;;;;;
